{
  "schemaVersion": "1.0",
  "feature": {
    "id": "WCRM010203",
    "title": "Dealer Activity Maintenance - DCM Vehicle",
    "summary": "UX-001 Init Mode only (Dealer Update Only). Add Mode is out of scope. API_Data_Map_Details is missing."
  },
  "sources": [
    {
      "id": "grill",
      "type": "grill",
      "title": "Agreed grill",
      "reference": "specs/WCRM010203/grill.md",
      "notes": "agreed Om Pandey; UX-001 only"
    },
    {
      "id": "dr-page",
      "type": "dr-page",
      "title": "[WCRM010203] Dealer Activity Maintenance - DCM Vehicle",
      "reference": "specs/WCRM010203/raw/page.md"
    },
    {
      "id": "item-desc",
      "type": "item-desc",
      "title": "Item_Desc_DCM_VehicleDealer",
      "reference": "specs/WCRM010203/raw/sheets/Item_Desc.md"
    },
    {
      "id": "data-map",
      "type": "data-map",
      "title": "DATA_MAP_DCM_Vehicle_Dealer_WCRM010203",
      "reference": "specs/WCRM010203/raw/sheets/DATA_MAP.md"
    },
    {
      "id": "ux-init",
      "type": "ux-image",
      "title": "Init Mode — DCM Vehicle - Dealer Update Only",
      "reference": "specs/WCRM010203/raw/images/DCM Vehicle - Dealer Update Only.png"
    },
    {
      "id": "ux-design",
      "type": "dr-page",
      "title": "UX Design section captions",
      "reference": "specs/WCRM010203/raw/ux-design.md"
    },
    {
      "id": "developer-decision-001",
      "type": "developer-decision",
      "title": "New screen; ignore existing ActivitySetupPage",
      "reference": "specs/WCRM010203/grill.json prior agreement"
    },
    {
      "id": "developer-decision-002",
      "type": "developer-decision",
      "title": "UX-001 Init Mode only; drop UX-002 Add Mode",
      "reference": "specs/WCRM010203/grill.json agreement.notes",
      "notes": "Om Pandey 2026-08-30"
    }
  ],
  "screen": {
    "name": "Dealer Activity Maintenance - DCM Vehicle",
    "route": null,
    "modes": ["init"]
  },
  "fields": [
    {
      "id": "field.back",
      "label": "Back",
      "uiType": "button",
      "section": "Header",
      "modeBehavior": { "init": { "visible": true, "editable": true } },
      "validation": [],
      "sourceRefs": [
        { "sourceId": "item-desc", "locator": "UI-DCM-001 Back" },
        { "sourceId": "ux-init", "locator": "Back above Activity Type" }
      ]
    },
    {
      "id": "field.activityType",
      "label": "Activity Type Selection",
      "uiType": "radio",
      "section": "Activity Type",
      "modeBehavior": { "init": { "visible": true, "editable": true } },
      "validation": [
        {
          "id": "VAL-ACTIVITY-TYPE-REQ",
          "rule": "required",
          "value": true,
          "message": "ERR0001 - {field} is required.",
          "sourceRefs": [
            { "sourceId": "dr-page", "locator": "Activity Type is mandatory" },
            { "sourceId": "item-desc", "locator": "UI-DCM-002 Mandatory Y" }
          ]
        }
      ],
      "sourceRefs": [
        { "sourceId": "item-desc", "locator": "UI-DCM-002 Radio; EVT-001 edit mode other types disabled" },
        { "sourceId": "ux-init", "locator": "Radios Periodic Maintenance … Body & Paint; DCM Vehicle selected" }
      ]
    },
    {
      "id": "field.summary.totalVehicles",
      "label": "Total Vehicles in Database",
      "uiType": "display",
      "section": "Dealer Vehicle Summary",
      "modeBehavior": { "init": { "visible": true, "editable": false } },
      "validation": [],
      "sourceRefs": [
        { "sourceId": "item-desc", "locator": "UI-DCM-003" },
        { "sourceId": "ux-init", "locator": "Summary card 60,000" },
        { "sourceId": "dr-page", "locator": "Dealer Vehicle Summary Section" }
      ]
    },
    {
      "id": "field.summary.individualCustomers",
      "label": "Total Individual Customers",
      "uiType": "display",
      "section": "Dealer Vehicle Summary",
      "modeBehavior": { "init": { "visible": true, "editable": false } },
      "validation": [],
      "sourceRefs": [
        { "sourceId": "item-desc", "locator": "UI-DCM-004" },
        { "sourceId": "ux-init", "locator": "Summary card with percentage" },
        { "sourceId": "dr-page", "locator": "percentage vs Total Customers" }
      ]
    },
    {
      "id": "field.summary.corporateCustomers",
      "label": "Total Corporate Customers",
      "uiType": "display",
      "section": "Dealer Vehicle Summary",
      "modeBehavior": { "init": { "visible": true, "editable": false } },
      "validation": [],
      "sourceRefs": [
        { "sourceId": "item-desc", "locator": "UI-DCM-005" },
        { "sourceId": "ux-init", "locator": "Summary card with percentage" },
        { "sourceId": "dr-page", "locator": "percentage vs Total Customers" }
      ]
    },
    {
      "id": "field.activityId",
      "label": "Activity ID",
      "uiType": "text",
      "section": "Activity Setup",
      "modeBehavior": { "init": { "visible": true, "editable": false } },
      "validation": [],
      "sourceRefs": [
        { "sourceId": "item-desc", "locator": "UI-DCM-006 read-only" },
        { "sourceId": "ux-init", "locator": "Activity ID AV260001" }
      ]
    },
    {
      "id": "field.activityName",
      "label": "Activity Name",
      "uiType": "text",
      "section": "Activity Setup",
      "modeBehavior": { "init": { "visible": true, "editable": true } },
      "validation": [
        {
          "id": "VAL-ACTIVITY-NAME-REQ",
          "rule": "required",
          "value": true,
          "message": "ERR0001 - {field} is required.",
          "sourceRefs": [
            { "sourceId": "dr-page", "locator": "Activity Name mandatory" },
            { "sourceId": "item-desc", "locator": "UI-DCM-007 Mandatory Y" },
            { "sourceId": "ux-init", "locator": "required marker on Activity Name" }
          ]
        },
        {
          "id": "VAL-ACTIVITY-NAME-MAX",
          "rule": "maxLength",
          "value": 250,
          "message": "Activity Name must not exceed 250 characters",
          "sourceRefs": [
            { "sourceId": "dr-page", "locator": "max 250" },
            { "sourceId": "item-desc", "locator": "UI-DCM-007 Length 250" }
          ]
        }
      ],
      "sourceRefs": [
        { "sourceId": "item-desc", "locator": "UI-DCM-007 Behavior Read-only auto-populated" },
        { "sourceId": "dr-page", "locator": "Edit Mode Activity Name not editable" },
        { "sourceId": "ux-init", "locator": "Activity Name value DCM Vehicle with required marker" }
      ]
    },
    {
      "id": "field.activityDescription",
      "label": "Activity Description",
      "uiType": "text",
      "section": "Activity Setup",
      "modeBehavior": { "init": { "visible": true, "editable": true } },
      "validation": [
        {
          "id": "VAL-ACTIVITY-DESC-REQ",
          "rule": "required",
          "value": true,
          "message": "ERR0001 - {field} is required.",
          "sourceRefs": [
            { "sourceId": "dr-page", "locator": "Description mandatory" },
            { "sourceId": "item-desc", "locator": "UI-DCM-008 Mandatory Y" },
            { "sourceId": "ux-init", "locator": "required marker" }
          ]
        },
        {
          "id": "VAL-ACTIVITY-DESC-MAX",
          "rule": "maxLength",
          "value": 1000,
          "message": "Activity Description must not exceed 1000 characters",
          "sourceRefs": [
            { "sourceId": "dr-page", "locator": "max 1000" },
            { "sourceId": "item-desc", "locator": "UI-DCM-008 Length 1000" }
          ]
        }
      ],
      "sourceRefs": [
        { "sourceId": "item-desc", "locator": "UI-DCM-008; EVT-003" },
        { "sourceId": "ux-init", "locator": "empty Activity Description" }
      ]
    },
    {
      "id": "field.customerType",
      "label": "Customer Type",
      "uiType": "select",
      "section": "Activity Setup",
      "modeBehavior": { "init": { "visible": true, "editable": true } },
      "validation": [
        {
          "id": "VAL-CUSTOMER-TYPE-REQ",
          "rule": "required",
          "value": true,
          "message": "ERR0001 - {field} is required.",
          "sourceRefs": [
            { "sourceId": "dr-page", "locator": "Customer Type mandatory" },
            { "sourceId": "item-desc", "locator": "UI-DCM-009 CMB-001" },
            { "sourceId": "ux-init", "locator": "required empty dropdown" }
          ]
        }
      ],
      "sourceRefs": [
        { "sourceId": "item-desc", "locator": "UI-DCM-009; EVT-004" }
      ]
    },
    {
      "id": "field.suppressDays",
      "label": "Suppress Days",
      "uiType": "number",
      "section": "Activity Setup",
      "modeBehavior": { "init": { "visible": true, "editable": true } },
      "validation": [
        {
          "id": "VAL-SUPPRESS-DAYS-REQ",
          "rule": "required",
          "value": true,
          "message": "ERR0001 - {field} is required.",
          "sourceRefs": [
            { "sourceId": "item-desc", "locator": "UI-DCM-010 Mandatory Y default 90" },
            { "sourceId": "ux-init", "locator": "value 90 with required marker" }
          ]
        },
        {
          "id": "VAL-SUPPRESS-DAYS-RANGE",
          "rule": "range",
          "value": { "min": 0, "max": 90 },
          "message": "ERR0020 - {field} must be between {min} and {max}.",
          "sourceRefs": [
            { "sourceId": "dr-page", "locator": "Suppress Days 0 to 90" }
          ]
        }
      ],
      "sourceRefs": [
        { "sourceId": "item-desc", "locator": "UI-DCM-010" },
        { "sourceId": "dr-page", "locator": "default 90 days" }
      ]
    },
    {
      "id": "field.dcmItem.select",
      "label": "Select Item",
      "uiType": "checkbox",
      "section": "DCM Vehicle Item",
      "modeBehavior": { "init": { "visible": true, "editable": true } },
      "validation": [
        {
          "id": "VAL-DCM-ITEM-MIN-ONE",
          "rule": "minSelected",
          "value": 1,